{
  "participant_id": "R_2QWcjBtboYh3Ak5",
  "demographics": {
    "age_years": 30,
    "gender_identity": "Female",
    "race_ethnicity": "American Indian or Alaska Native",
    "is_hispanic_latino": "No",
    "education_level": "Less than high school",
    "household_income": "< $15,000"
  },
  "smoking_behavior": {
    "quit_intention": "Are currently trying to quit",
    "days_smoked_past_30d": 30,
    "cigs_per_day": "6",
    "time_to_first_cig": "Within 30 minutes",
    "household_smokers": "Yes",
    "friends_smoke_level": "All of them",
    "quit_attempts_count": "6",
    "smoking_status": "Every day",
    "quit_motivation_level": "Extremely motivated",
    "social_support_to_quit": "Very supportive"
  },
  "psychosocial": {
    "pain_blocks_valued_life": "Sometimes true",
    "fear_of_feelings": "Sometimes true",
    "worry_about_control": "Almost always true",
    "memories_block_fulfillment": "Almost always true",
    "emotions_cause_problems": "Always true",
    "others_handle_life_better": "Always true",
    "worry_blocks_success": "Always true"
  },
  "history": {
    "rated_messages": [
      {
        "input_message": "Some people find it helpful to give a name to their urge. If you're experiencing regular urges, give that feeling a name ('Olga the urge'?), and tell it that you won't give in to it. It may make it easier to live with (e.g. \"ok Olga, I need to be by myself now...\").",
        "ImageID": "A3",
        "ratings": {
          "content": "Very good",
          "design": "Good",
          "coping": "Moderately helpful",
          "quitting": "Moderately helpful"
        }
      },
      {
        "input_message": "Just because other people are smoking, doesn't mean you have to. Practice allowing this urge to be present for 5 minutes. When it passes, give yourself credit.",
        "ImageID": "A59",
        "ratings": {
          "content": "Very good",
          "design": "Very good",
          "coping": "Extremely helpful",
          "quitting": "Very helpful"
        }
      },
      {
        "input_message": "If this situation becomes stressful for you, make an excuse to leave for a few minutes. If this doesn't help, it might be better to just leave early.",
        "ImageID": "D31",
        "ratings": {
          "content": "Very good",
          "design": "Very good",
          "coping": "Extremely helpful",
          "quitting": "Very helpful"
        }
      },
      {
        "input_message": "When a craving hits, keep your hands busy by doing the dishes or taking out the trash. Small chores will help pass the time during a craving.",
        "ImageID": "D41",
        "ratings": {
          "content": "Good",
          "design": "Good",
          "coping": "Moderately helpful",
          "quitting": "Moderately helpful"
        }
      },
      {
        "input_message": "What can you do right now to break the automatic habit of smoking to help you feel better? Pause. Close your eyes. And take 10 slow breaths.",
        "ImageID": "A37",
        "ratings": {
          "content": "Good",
          "design": "Good",
          "coping": "Very helpful",
          "quitting": "Very helpful"
        }
      },
      {
        "input_message": "Sometimes an urge comes on like a wave. Imagine what it is like to ride the wave as it ebbs and flows. Instead of trying to swim against it, try riding it out until it disappears into the sea.",
        "ImageID": "A12",
        "ratings": {
          "content": "Very good",
          "design": "Very good",
          "coping": "Extremely helpful",
          "quitting": "Extremely helpful"
        }
      },
      {
        "input_message": "Stop and take 3 deep breaths. Then decide if you really want to smoke right now or not. Pausing for a few breaths can help lessen the habit.",
        "ImageID": "A26",
        "ratings": {
          "content": "Good",
          "design": "Good",
          "coping": "Moderately helpful",
          "quitting": "Moderately helpful"
        }
      },
      {
        "input_message": "You spent a long time training your brain to want a cig. Now you're retraining your brain, and it's natural that this might take time.",
        "ImageID": "D12",
        "ratings": {
          "content": "Good",
          "design": "Good",
          "coping": "Very helpful",
          "quitting": "Very helpful"
        }
      },
      {
        "input_message": "Take a minute to notice what the urge feels like in your body without smoking a cigarette. Notice what is going on. See what happens. Does the urge pass?",
        "ImageID": "A21",
        "ratings": {
          "content": "Good",
          "design": "Good",
          "coping": "Not at all helpful",
          "quitting": "Not at all helpful"
        }
      },
      {
        "input_message": "Setting small goals when you feel unmotivated is best. Maybe a small goal for now is to breathe deeply for the next 3 minutes instead of smoking.",
        "ImageID": "D68",
        "ratings": {
          "content": "Good",
          "design": "Good",
          "coping": "Very helpful",
          "quitting": "Very helpful"
        }
      }
    ]
  },
  "summary_text": "Age 30, Female, Every day, Motivation: Extremely motivated, Support: Very supportive, CPD: 6, TTF: Within 30 minutes"
}