{
  "participant_id": "R_2B3VWlCR2CLiZVA",
  "demographics": {
    "age_years": 30,
    "gender_identity": "Female",
    "race_ethnicity": "White",
    "is_hispanic_latino": "Yes",
    "education_level": "Professional or Doctoral degree (MD, JD, PhD, etc.)",
    "household_income": "$80,000-99,000"
  },
  "smoking_behavior": {
    "quit_intention": "Will quit in the next month",
    "days_smoked_past_30d": 5,
    "cigs_per_day": "4",
    "time_to_first_cig": "Within 30 minutes",
    "household_smokers": "Yes",
    "friends_smoke_level": "All of them",
    "smoking_status": "Every day",
    "quit_motivation_level": "Very motivated",
    "social_support_to_quit": "Moderately supportive"
  },
  "psychosocial": {
    "pain_blocks_valued_life": "Seldom true",
    "fear_of_feelings": "Almost always true",
    "worry_about_control": "Frequently true",
    "memories_block_fulfillment": "Frequently true",
    "emotions_cause_problems": "Sometimes true",
    "others_handle_life_better": "Seldom true",
    "worry_blocks_success": "Almost always true"
  },
  "history": {
    "rated_messages": [
      {
        "input_message": "Practice going 10 minutes without smoking. Think of it just as practice. When the urge passes, reward yourself with a break from work or dinner from your favorite restaurant!",
        "ImageID": "A11",
        "ratings": {
          "content": "Good",
          "design": "Acceptable",
          "coping": "Extremely helpful",
          "quitting": "Moderately helpful"
        }
      },
      {
        "input_message": "Stress is temporary. It comes and goes like passing clouds in the sky. When stress demands you to light up, remember you can let it pass by without smoking.",
        "ImageID": "A33",
        "ratings": {
          "content": "Very good",
          "design": "Good",
          "coping": "Not at all helpful",
          "quitting": "Moderately  helpful"
        }
      },
      {
        "input_message": "Think about what is really important to you. Maybe it's spending time with family or a friend, exercising, doing something spiritual, or creating something. Whatever it is, take a step in that direction.",
        "ImageID": "D69",
        "ratings": {
          "content": "Good",
          "design": "Very good",
          "coping": "Very helpful",
          "quitting": "Moderately helpful"
        }
      },
      {
        "input_message": "Take a minute to notice what the urge feels like in your body without smoking a cigarette. Notice what is going on. See what happens. Does the urge pass?",
        "ImageID": "A21",
        "ratings": {
          "content": "Good",
          "design": "Good",
          "coping": "Very helpful",
          "quitting": "Extremely helpful"
        }
      },
      {
        "input_message": "Imagine your urge is like a talk radio station going on about something you disagree with. Arguing with it doesn't change what they say. Instead, just let them talk while you focus on what's important to you.",
        "ImageID": "A14",
        "ratings": {
          "content": "Very good",
          "design": "Acceptable",
          "coping": "Moderately helpful",
          "quitting": "Very helpful"
        }
      },
      {
        "input_message": "Read this rule out loud (if you can): IF someone offers me a cigarette THEN I will say 'no thanks, I don't want one.' Reading out if/then rules has been shown to help people stick with their decisions.",
        "ImageID": "D25",
        "ratings": {
          "content": "Good",
          "design": "Good",
          "coping": "Somewhat helpful",
          "quitting": "Very helpful"
        }
      },
      {
        "input_message": "Instead of smoking, think of 3 things from today that you are grateful for. These can be anything, even small things! Now ask yourself, why are you grateful for these things?",
        "ImageID": "D60",
        "ratings": {
          "content": "Poor",
          "design": "Very good",
          "coping": "Not at all helpful",
          "quitting": "Very helpful"
        }
      },
      {
        "input_message": "When your mind tells you that you will be less stressed after smoking a cigarette, remember that you don't have to listen to that thought. It's just a thought and nothing more.",
        "ImageID": "A32",
        "ratings": {
          "content": "Poor",
          "design": "Very good",
          "coping": "Extremely helpful",
          "quitting": "Very helpful"
        }
      },
      {
        "input_message": "What can you do right now to break the automatic habit of smoking when you are here? Pause. Close your eyes. And take 10 slow breaths.",
        "ImageID": "A54",
        "ratings": {
          "content": "Poor",
          "design": "Very good",
          "coping": "Very helpful",
          "quitting": "Somewhat helpful"
        }
      },
      {
        "input_message": "It's quite common for people to try and give themselves reasons for having 'just one' when they start working on quitting smoking. If you have these thoughts, let them happen, then picture yourself putting them into a hot-air balloon and watch them float away.",
        "ImageID": "A2",
        "ratings": {
          "content": "Very good",
          "design": "Very good",
          "coping": "Very helpful",
          "quitting": "Somewhat helpful"
        }
      }
    ]
  },
  "summary_text": "Age 30, Female, Every day, Motivation: Very motivated, Support: Moderately supportive, CPD: 4, TTF: Within 30 minutes"
}