{
  "participant_id": "R_2XniPJa9AUwPfVI",
  "demographics": {
    "age_years": 28,
    "gender_identity": "Male",
    "race_ethnicity": "White",
    "is_hispanic_latino": "No",
    "education_level": "Bachelor's degree",
    "household_income": "$25,000-39,999"
  },
  "smoking_behavior": {
    "quit_intention": "Are currently trying to quit",
    "days_smoked_past_30d": 25,
    "cigs_per_day": "13",
    "time_to_first_cig": "Within 30 minutes",
    "household_smokers": "No",
    "friends_smoke_level": "Most of them",
    "quit_attempts_count": "5",
    "smoking_status": "Every day",
    "quit_motivation_level": "Very motivated",
    "social_support_to_quit": "Very supportive"
  },
  "psychosocial": {
    "pain_blocks_valued_life": "Almost always true",
    "fear_of_feelings": "Always true",
    "worry_about_control": "Almost always true",
    "memories_block_fulfillment": "Frequently true",
    "emotions_cause_problems": "Almost always true",
    "others_handle_life_better": "Frequently true",
    "worry_blocks_success": "Frequently true"
  },
  "history": {
    "rated_messages": [
      {
        "input_message": "A funny thing about people is that we tend to believe what we tell ourselves. So make sure that whatever else happens today, tell yourself \"I can, and I will stick to not smoking!\"",
        "ImageID": "D13",
        "ratings": {
          "content": "Very good",
          "design": "Very good",
          "coping": "Extremely helpful",
          "quitting": "Very helpful"
        }
      },
      {
        "input_message": "Crumple a piece of paper into a ball and imagine it is your urge. Toss the \"urge\" into the garbage or against the wall. By doing this, you are letting go of your urges.",
        "ImageID": "A16",
        "ratings": {
          "content": "Good",
          "design": "Very good",
          "coping": "Very helpful",
          "quitting": "Extremely helpful"
        }
      },
      {
        "input_message": "Try to avoid seeing other people smoke. It might sound basic but brain see, brain want! If you can, make life easier and avoid the people you used to smoke with for some time where possible.",
        "ImageID": "D30",
        "ratings": {
          "content": "Good",
          "design": "Very good",
          "coping": "Extremely helpful",
          "quitting": "Very helpful"
        }
      },
      {
        "input_message": "If you find yourself thinking: \"I can't do this\", \"I need a cig\", or \"I'll just have one\", make sure you tell yourself \"I absolutely CAN do this\", \"I'm in control\". Take control of your negative thoughts!",
        "ImageID": "D29",
        "ratings": {
          "content": "Very good",
          "design": "Good",
          "coping": "Extremely helpful",
          "quitting": "Very helpful"
        }
      },
      {
        "input_message": "To help get through a 'risky situation', remind yourself of how far you've come and the effort that you've put in. Don't ruin your hard work - stay strong!",
        "ImageID": "D24",
        "ratings": {
          "content": "Very good",
          "design": "Good",
          "coping": "Extremely helpful",
          "quitting": "Extremely helpful"
        }
      },
      {
        "input_message": "You cant always control when you will see other people smoking. But you can control how you respond to your urge when you do.",
        "ImageID": "A55",
        "ratings": {
          "content": "Very good",
          "design": "Good",
          "coping": "Extremely helpful",
          "quitting": "Extremely helpful"
        }
      },
      {
        "input_message": "When smoking, it can feel like your hands are for holding a cigarette, your mouth is for smoking the cigarette, and your chest and lungs need to breathe in the smoke. Spend 3 minutes noticing how your hands feel, how your mouth feels, and how your chest feels. The more you practice noticing these things without smoking, the sooner your body will stop being a trigger for you.",
        "ImageID": "A22",
        "ratings": {
          "content": "Very good",
          "design": "Good",
          "coping": "Extremely helpful",
          "quitting": "Very helpful"
        }
      },
      {
        "input_message": "This craving is just an event. A game. It will pass. The game gets easier the more you let your urge pass without smoking. But, it gets harder every time you give in to the urge and smoke.",
        "ImageID": "A31",
        "ratings": {
          "content": "Very good",
          "design": "Good",
          "coping": "Extremely helpful",
          "quitting": "Extremely helpful"
        }
      },
      {
        "input_message": "Tell yourself, \u201cI am going to quit smoking soon.\u201d Say it out loud. Say to yourself, \u201cI am too strong to continue smoking for the rest of my life.\"",
        "ImageID": "D40",
        "ratings": {
          "content": "Very good",
          "design": "Good",
          "coping": "Extremely helpful",
          "quitting": "Very helpful"
        }
      },
      {
        "input_message": "If leaving social situations to avoid smokers feels awkward, make sure you have something to do instead - take sugar free mints, lollipops or low fat snacks to chew, or use a stress ball.",
        "ImageID": "D22",
        "ratings": {
          "content": "Very good",
          "design": "Very good",
          "coping": "Very helpful",
          "quitting": "Extremely helpful"
        }
      }
    ]
  },
  "summary_text": "Age 28, Male, Every day, Motivation: Very motivated, Support: Very supportive, CPD: 13, TTF: Within 30 minutes"
}