{
  "participant_id": "R_ufyczALtFUdvzCF",
  "demographics": {
    "age_years": 23,
    "gender_identity": "Male",
    "race_ethnicity": "White",
    "is_hispanic_latino": "No",
    "education_level": "Bachelor's degree",
    "household_income": ">=$100,000"
  },
  "smoking_behavior": {
    "quit_intention": "Are currently trying to quit",
    "days_smoked_past_30d": 30,
    "cigs_per_day": "3",
    "time_to_first_cig": "Within 30 minutes",
    "household_smokers": "Yes",
    "friends_smoke_level": "Most of them",
    "quit_attempts_count": "5",
    "smoking_status": "Every day",
    "quit_motivation_level": "Very motivated",
    "social_support_to_quit": "Very supportive"
  },
  "psychosocial": {
    "pain_blocks_valued_life": "Frequently true",
    "fear_of_feelings": "Almost always true",
    "worry_about_control": "Almost always true",
    "memories_block_fulfillment": "Almost always true",
    "emotions_cause_problems": "Almost always true",
    "others_handle_life_better": "Frequently true",
    "worry_blocks_success": "Seldom true"
  },
  "history": {
    "rated_messages": [
      {
        "input_message": "Just because letting an urge pass isn't easy, doesn't mean that you can't do it. Try it, you might surprise yourself.",
        "ImageID": "A29",
        "ratings": {
          "content": "Acceptable",
          "design": "Very good",
          "coping": "Moderately helpful",
          "quitting": "Very helpful"
        }
      },
      {
        "input_message": "Each time you choose to not smoke after seeing someone else light up, you lessen the habit a little more.",
        "ImageID": "A58",
        "ratings": {
          "content": "Acceptable",
          "design": "Very good",
          "coping": "Moderately helpful",
          "quitting": "Extremely helpful"
        }
      },
      {
        "input_message": "Sometimes an urge comes on like a wave. Imagine what it is like to ride the wave as it ebbs and flows. Instead of trying to swim against it, try riding it out until it disappears into the sea.",
        "ImageID": "A12",
        "ratings": {
          "content": "Good",
          "design": "Very good",
          "coping": "Moderately helpful",
          "quitting": "Very helpful"
        }
      },
      {
        "input_message": "Urges are like annoying ads. You might see them but you don't have to buy what they're selling.",
        "ImageID": "A30",
        "ratings": {
          "content": "Good",
          "design": "Very good",
          "coping": "Moderately helpful",
          "quitting": "Very helpful"
        }
      },
      {
        "input_message": "A funny thing about people is that we tend to believe what we tell ourselves. So make sure that whatever else happens today, tell yourself \"I can, and I will stick to not smoking!\"",
        "ImageID": "D13",
        "ratings": {
          "content": "Acceptable",
          "design": "Good",
          "coping": "Extremely helpful",
          "quitting": "Moderately helpful"
        }
      },
      {
        "input_message": "Spend 3 minutes noticing how your hands feel, how your mouth feels, and how your chest feels. The more you practice noticing these things without smoking, the sooner this place will stop being a trigger for you.",
        "ImageID": "A53",
        "ratings": {
          "content": "Good",
          "design": "Very good",
          "coping": "Very helpful",
          "quitting": "Moderately helpful"
        }
      },
      {
        "input_message": "If you're stuck at home and physical activity doesn't interest you, try gaming, needlework, drawing, or journaling.",
        "ImageID": "D44",
        "ratings": {
          "content": "Good",
          "design": "Very good",
          "coping": "Very helpful",
          "quitting": "Moderately helpful"
        }
      },
      {
        "input_message": "Pause. Notice what triggered you to smoke in the past. Now take one deep breath and remind yourself that you do not need to smoke.",
        "ImageID": "A8",
        "ratings": {
          "content": "Good",
          "design": "Very good",
          "coping": "Moderately helpful",
          "quitting": "Very helpful"
        }
      },
      {
        "input_message": "Pause. Notice what triggered you to smoke in the past. Now take one deep breath and remind yourself that you do not need to smoke.",
        "ImageID": "A43",
        "ratings": {
          "content": "Good",
          "design": "Very good",
          "coping": "Moderately helpful",
          "quitting": "Very helpful"
        }
      },
      {
        "input_message": "Ask yourself, \"What do I need right now? Is it really a smoke, or is there something else I need? How can I best take care of myself right now?\"",
        "ImageID": "D62",
        "ratings": {
          "content": "Good",
          "design": "Good",
          "coping": "Extremely helpful",
          "quitting": "Very helpful"
        }
      },
      {
        "input_message": "Each time you let an urge pass without smoking, you break the old habit a bit more.",
        "ImageID": "A27",
        "ratings": {
          "content": "Good",
          "design": "Very good",
          "coping": "Very helpful",
          "quitting": "Very helpful"
        }
      }
    ]
  },
  "summary_text": "Age 23, Male, Every day, Motivation: Very motivated, Support: Very supportive, CPD: 3, TTF: Within 30 minutes"
}