{
  "participant_id": "R_1K42Ti9DFVWU3di",
  "demographics": {
    "age_years": 25,
    "gender_identity": "Female",
    "race_ethnicity": "White",
    "is_hispanic_latino": "No",
    "education_level": "Some college",
    "household_income": "$25,000-39,999"
  },
  "smoking_behavior": {
    "quit_intention": "Are currently trying to quit",
    "days_smoked_past_30d": 2,
    "cigs_per_day": "0",
    "time_to_first_cig": "After 30 minutes",
    "household_smokers": "No",
    "friends_smoke_level": "Some of them",
    "quit_attempts_count": "1",
    "smoking_status": "Some days",
    "quit_motivation_level": "Very motivated",
    "social_support_to_quit": "Extremely supportive"
  },
  "psychosocial": {
    "pain_blocks_valued_life": "Frequently true",
    "fear_of_feelings": "Almost always true",
    "worry_about_control": "Almost always true",
    "memories_block_fulfillment": "Frequently true",
    "emotions_cause_problems": "Almost always true",
    "others_handle_life_better": "Always true",
    "worry_blocks_success": "Always true"
  },
  "history": {
    "rated_messages": [
      {
        "input_message": "When smoking, it can feel like your hands are for holding a cigarette, your mouth is for smoking the cigarette, and your chest and lungs need to breathe in the smoke. Spend 3 minutes noticing how your hands feel, how your mouth feels, and how your chest feels. The more you practice noticing these things without smoking, the sooner your body will stop being a trigger for you.",
        "ImageID": "A22",
        "ratings": {
          "content": "Good",
          "design": "Good",
          "coping": "Moderately helpful",
          "quitting": "Very helpful"
        }
      },
      {
        "input_message": "As smokers are usually with you in this location, it's really important that you're not with them when they smoke. Consider avoiding this place if possible until things settle down.",
        "ImageID": "D37",
        "ratings": {
          "content": "Poor",
          "design": "Poor",
          "coping": "Somewhat helpful",
          "quitting": "Not at all helpful"
        }
      },
      {
        "input_message": "Each time you let an urge pass without smoking, you break the old habit a bit more.",
        "ImageID": "A27",
        "ratings": {
          "content": "Acceptable",
          "design": "Good",
          "coping": "Somewhat helpful",
          "quitting": "Moderately helpful"
        }
      },
      {
        "input_message": "Whenever you think about smoking, listen to your favorite song and sing it out loud!",
        "ImageID": "D57",
        "ratings": {
          "content": "Very good",
          "design": "Very good",
          "coping": "Extremely helpful",
          "quitting": "Extremely helpful"
        }
      },
      {
        "input_message": "You were often stressed in this location and this might trigger urges. What can you do to reduce your stress here? If you can avoid this place until things settle down, then do.",
        "ImageID": "D38",
        "ratings": {
          "content": "Good",
          "design": "Acceptable",
          "coping": "Very helpful",
          "quitting": "Extremely helpful"
        }
      },
      {
        "input_message": "Crumple a piece of paper into a ball and imagine it is your urge. Toss the \"urge\" into the garbage or against the wall. By doing this, you are letting go of your urges.",
        "ImageID": "A16",
        "ratings": {
          "content": "Good",
          "design": "Poor",
          "coping": "Moderately helpful",
          "quitting": "Moderately helpful"
        }
      },
      {
        "input_message": "When you begin to crave a cig, concentrate on your reasons for not smoking. Keep a list on your phone and look at it when you feel yourself beginning to falter.",
        "ImageID": "D50",
        "ratings": {
          "content": "Very good",
          "design": "Good",
          "coping": "Very helpful",
          "quitting": "Very helpful"
        }
      },
      {
        "input_message": "When you notice yourself trapped in stressful thoughts or worry, say out loud, \"I'm noticing that I'm having some worrisome thoughts.\" This helps unhook you from your thoughts so you don't stay caught in them.",
        "ImageID": "A34",
        "ratings": {
          "content": "Good",
          "design": "Poor",
          "coping": "Moderately helpful",
          "quitting": "Somewhat helpful"
        }
      },
      {
        "input_message": "Instead of smoking, use the next two minutes to pay close attention to your senses. Notice what you see, hear, feel, taste, and smell. Urges are just one part of your experience.",
        "ImageID": "A23",
        "ratings": {
          "content": "Very good",
          "design": "Very good",
          "coping": "Very helpful",
          "quitting": "Extremely helpful"
        }
      },
      {
        "input_message": "Take a minute to notice what the urge feels like in your body without smoking a cigarette. Notice what is going on. See what happens. Does the urge pass?",
        "ImageID": "A21",
        "ratings": {
          "content": "Good",
          "design": "Acceptable",
          "coping": "Very helpful",
          "quitting": "Moderately helpful"
        }
      }
    ]
  },
  "summary_text": "Age 25, Female, Some days, Motivation: Very motivated, Support: Extremely supportive, CPD: 0, TTF: After 30 minutes"
}