{
  "participant_id": "R_sUxSt3ehJsAth2F",
  "demographics": {
    "age_years": 30,
    "gender_identity": "Male",
    "race_ethnicity": "White",
    "is_hispanic_latino": "No",
    "education_level": "Bachelor's degree",
    "household_income": "$80,000-99,000"
  },
  "smoking_behavior": {
    "quit_intention": "Are currently trying to quit",
    "days_smoked_past_30d": 26,
    "cigs_per_day": "12",
    "time_to_first_cig": "Within 30 minutes",
    "household_smokers": "Yes",
    "friends_smoke_level": "Most of them",
    "smoking_status": "Every day",
    "quit_motivation_level": "Moderately motivated",
    "social_support_to_quit": "Extremely supportive"
  },
  "psychosocial": {
    "pain_blocks_valued_life": "Very seldom true",
    "fear_of_feelings": "Seldom true",
    "worry_about_control": "Never true",
    "memories_block_fulfillment": "Very seldom true",
    "emotions_cause_problems": "Never true",
    "others_handle_life_better": "Very seldom true",
    "worry_blocks_success": "Very seldom true"
  },
  "history": {
    "rated_messages": [
      {
        "input_message": "Use self-talk to stay motivated and determined. Say, \u201cI don't need a cigarette. I might WANT one, but I don\u2019t NEED it.\u201d",
        "ImageID": "D53",
        "ratings": {
          "content": "Very good",
          "design": "Very good",
          "coping": "Extremely helpful",
          "quitting": "Very helpful"
        }
      },
      {
        "input_message": "Try to stop smoking by setting yourself a rule. For example, \"IF I am tempted, THEN I will chew on some mints\" - make your own rule that will work for you.",
        "ImageID": "D9",
        "ratings": {
          "content": "Very good",
          "design": "Good",
          "coping": "Extremely helpful",
          "quitting": "Very helpful"
        }
      },
      {
        "input_message": "Tell yourself, \u201cI am going to quit smoking soon.\u201d Say it out loud. Say to yourself, \u201cI am too strong to continue smoking for the rest of my life.\"",
        "ImageID": "D40",
        "ratings": {
          "content": "Acceptable",
          "design": "Acceptable",
          "coping": "Very helpful",
          "quitting": "Moderately helpful"
        }
      },
      {
        "input_message": "Take a minute to notice what the urge feels like in your body without smoking a cigarette. Notice what is going on. See what happens. Does the urge pass?",
        "ImageID": "A21",
        "ratings": {
          "content": "Very good",
          "design": "Very good",
          "coping": "Extremely helpful",
          "quitting": "Extremely helpful"
        }
      },
      {
        "input_message": "Some people find it helpful to give a name to their urge. If you're experiencing regular urges, give that feeling a name ('Olga the urge'?), and tell it that you won't give in to it. It may make it easier to live with (e.g. \"ok Olga, I need to be by myself now...\").",
        "ImageID": "A3",
        "ratings": {
          "content": "Very good",
          "design": "Good",
          "coping": "Extremely helpful",
          "quitting": "Extremely helpful"
        }
      },
      {
        "input_message": "A funny thing about people is that we tend to believe what we tell ourselves. So make sure that whatever else happens today, tell yourself \"I can, and I will stick to not smoking!\"",
        "ImageID": "D13",
        "ratings": {
          "content": "Good",
          "design": "Very good",
          "coping": "Extremely helpful",
          "quitting": "Extremely helpful"
        }
      },
      {
        "input_message": "If you usually smoke while you talk on the phone, try taking the next call in a place where you can't smoke and focus on the conversation. The urge will pass.",
        "ImageID": "D43",
        "ratings": {
          "content": "Good",
          "design": "Very good",
          "coping": "Very helpful",
          "quitting": "Extremely helpful"
        }
      },
      {
        "input_message": "You were often stressed in this location and this might trigger urges. What can you do to reduce your stress here? If you can avoid this place until things settle down, then do.",
        "ImageID": "D38",
        "ratings": {
          "content": "Very good",
          "design": "Very good",
          "coping": "Very helpful",
          "quitting": "Extremely helpful"
        }
      },
      {
        "input_message": "Think of urges as loud construction noises. Sometimes there's nothing you can do except agree that it's annoying. If you fight it, you feel more irritated, right? Let your urge be there until it passes on its own.",
        "ImageID": "A13",
        "ratings": {
          "content": "Good",
          "design": "Very good",
          "coping": "Very helpful",
          "quitting": "Extremely helpful"
        }
      },
      {
        "input_message": "Crumple a piece of paper into a ball and imagine it is your urge. Toss the \"urge\" into the garbage or against the wall. By doing this, you are letting go of your urges.",
        "ImageID": "A16",
        "ratings": {
          "content": "Very good",
          "design": "Good",
          "coping": "Very helpful",
          "quitting": "Extremely helpful"
        }
      }
    ]
  },
  "summary_text": "Age 30, Male, Every day, Motivation: Moderately motivated, Support: Extremely supportive, CPD: 12, TTF: Within 30 minutes"
}