{
  "participant_id": "R_3DAxhMwsbbHPLhL",
  "demographics": {
    "age_years": 25,
    "gender_identity": "Male",
    "race_ethnicity": "White",
    "is_hispanic_latino": "No",
    "education_level": "Bachelor's degree",
    "household_income": "$80,000-99,000"
  },
  "smoking_behavior": {
    "quit_intention": "Are currently trying to quit",
    "days_smoked_past_30d": 17,
    "cigs_per_day": "8",
    "time_to_first_cig": "Within 30 minutes",
    "household_smokers": "Yes",
    "friends_smoke_level": "Most of them",
    "quit_attempts_count": "7",
    "smoking_status": "Every day",
    "quit_motivation_level": "Very motivated",
    "social_support_to_quit": "Very supportive"
  },
  "psychosocial": {
    "pain_blocks_valued_life": "Frequently true",
    "fear_of_feelings": "Almost always true",
    "worry_about_control": "Almost always true",
    "memories_block_fulfillment": "Almost always true",
    "emotions_cause_problems": "Frequently true",
    "others_handle_life_better": "Almost always true",
    "worry_blocks_success": "Sometimes true"
  },
  "history": {
    "rated_messages": [
      {
        "input_message": "Remind yourself that by staying quit, you'll be freeing yourself from the constant cycle of cigarette, nicotine withdrawal, feeling stressed as a result and wanting another cigarette. Keep going and this will be a thing of the past!",
        "ImageID": "D14",
        "ratings": {
          "content": "Very good",
          "design": "Good",
          "coping": "Very helpful",
          "quitting": "Very helpful"
        }
      },
      {
        "input_message": "Instead of smoking, use the next two minutes to pay close attention to your senses. Notice what you see, hear, feel, taste, and smell. Urges are just one part of your experience.",
        "ImageID": "A23",
        "ratings": {
          "content": "Very good",
          "design": "Good",
          "coping": "Very helpful",
          "quitting": "Moderately  helpful"
        }
      },
      {
        "input_message": "Imagine this urge as just another backseat passenger that hopped in after seeing other people smoke. You are the driver and you still get to call the shots.",
        "ImageID": "A60",
        "ratings": {
          "content": "Very good",
          "design": "Very good",
          "coping": "Extremely helpful",
          "quitting": "Extremely helpful"
        }
      },
      {
        "input_message": "Spend 3 minutes noticing how your hands feel, how your mouth feels, and how your chest feels. The more you practice noticing these things without smoking, the sooner this place will stop being a trigger for you.",
        "ImageID": "A53",
        "ratings": {
          "content": "Good",
          "design": "Good",
          "coping": "Very helpful",
          "quitting": "Very helpful"
        }
      },
      {
        "input_message": "When running a marathon, the hardest part is often towards the end, but many runners stick with it, knowing that the pain will pass. Learning to quit smoking is like running a marathon - if it gets hard, you may be closer to succeeding than you realize!",
        "ImageID": "A4",
        "ratings": {
          "content": "Good",
          "design": "Very good",
          "coping": "Extremely helpful",
          "quitting": "Very helpful"
        }
      },
      {
        "input_message": "Some people find that having a simple mantra can really help, especially if things feel stressful. Try repeating something simple to yourself like: \"I can do it!\".",
        "ImageID": "D16",
        "ratings": {
          "content": "Very good",
          "design": "Very good",
          "coping": "Extremely helpful",
          "quitting": "Extremely helpful"
        }
      },
      {
        "input_message": "Some places trigger powerful cravings, that is to be expected. Stop and notice where in your body you feel those cravings and remind yourself that cravings typically pass in 1 to 3 minutes",
        "ImageID": "A50",
        "ratings": {
          "content": "Good",
          "design": "Acceptable",
          "coping": "Very helpful",
          "quitting": "Very helpful"
        }
      },
      {
        "input_message": "If you find sounds soothing, tune in to the soundtrack of nature, like crashing waves, the wind rustling through trees, or birds singing.",
        "ImageID": "D48",
        "ratings": {
          "content": "Very good",
          "design": "Very good",
          "coping": "Extremely helpful",
          "quitting": "Extremely helpful"
        }
      },
      {
        "input_message": "Step back from what is stressful by taking 10 slow breaths. Count them as you go and notice your breath. If you get distracted, keep starting over until you get to 10.",
        "ImageID": "D67",
        "ratings": {
          "content": "Acceptable",
          "design": "Good",
          "coping": "Very helpful",
          "quitting": "Very helpful"
        }
      },
      {
        "input_message": "Pause. Notice the feelings you are having without judgement. Let them come and go. Being aware of your feelings means you can make a new choice about how you respond to your urges instead of smoking on autopilot.",
        "ImageID": "A8",
        "ratings": {
          "content": "Acceptable",
          "design": "Acceptable",
          "coping": "Very helpful",
          "quitting": "Extremely helpful"
        }
      },
      {
        "input_message": "Pause. Notice the feelings you are having without judgement. Let them come and go. Being aware of your feelings means you can make a new choice about how you respond to your urges instead of smoking on autopilot.",
        "ImageID": "A43",
        "ratings": {
          "content": "Acceptable",
          "design": "Acceptable",
          "coping": "Very helpful",
          "quitting": "Extremely helpful"
        }
      }
    ]
  },
  "summary_text": "Age 25, Male, Every day, Motivation: Very motivated, Support: Very supportive, CPD: 8, TTF: Within 30 minutes"
}