{
  "participant_id": "R_1rcSCJTMLCcgdGU",
  "demographics": {
    "age_years": 30,
    "gender_identity": "Female",
    "race_ethnicity": "White",
    "is_hispanic_latino": "No",
    "education_level": "Some college",
    "household_income": "$60,000-79,999"
  },
  "smoking_behavior": {
    "quit_intention": "Are currently trying to quit",
    "days_smoked_past_30d": 29,
    "cigs_per_day": "4",
    "time_to_first_cig": "After 30 minutes",
    "household_smokers": "No",
    "friends_smoke_level": "Most of them",
    "smoking_status": "Every day",
    "quit_motivation_level": "Extremely motivated",
    "social_support_to_quit": "Moderately supportive"
  },
  "psychosocial": {
    "pain_blocks_valued_life": "Seldom true",
    "fear_of_feelings": "Sometimes true",
    "worry_about_control": "Sometimes true",
    "memories_block_fulfillment": "Seldom true",
    "emotions_cause_problems": "Seldom true",
    "others_handle_life_better": "Seldom true",
    "worry_blocks_success": "Sometimes true"
  },
  "history": {
    "rated_messages": [
      {
        "input_message": "Use self-talk to stay motivated and determined. Say, \u201cI don't need a cigarette. I might WANT one, but I don\u2019t NEED it.\u201d",
        "ImageID": "D53",
        "ratings": {
          "content": "Acceptable",
          "design": "Poor",
          "coping": "Not at all helpful",
          "quitting": "Not at all helpful"
        }
      },
      {
        "input_message": "If you find sounds soothing, tune in to the soundtrack of nature, like crashing waves, the wind rustling through trees, or birds singing.",
        "ImageID": "D48",
        "ratings": {
          "content": "Acceptable",
          "design": "Acceptable",
          "coping": "Not at all helpful",
          "quitting": "Not at all helpful"
        }
      },
      {
        "input_message": "You spent a long time training your brain to want a cig. Now you're retraining your brain, and it's natural that this might take time.",
        "ImageID": "D12",
        "ratings": {
          "content": "Acceptable",
          "design": "Acceptable",
          "coping": "Somewhat helpful",
          "quitting": "Somewhat helpful"
        }
      },
      {
        "input_message": "If you find yourself thinking: \"I can't do this\", \"I need a cig\", or \"I'll just have one\", make sure you tell yourself \"I absolutely CAN do this\", \"I'm in control\". Take control of your negative thoughts!",
        "ImageID": "D29",
        "ratings": {
          "content": "Acceptable",
          "design": "Acceptable",
          "coping": "Somewhat helpful",
          "quitting": "Somewhat helpful"
        }
      },
      {
        "input_message": "Just because other people are smoking, doesn't mean you have to. Practice allowing this urge to be present for 5 minutes. When it passes, give yourself credit.",
        "ImageID": "A59",
        "ratings": {
          "content": "Acceptable",
          "design": "Acceptable",
          "coping": "Somewhat helpful",
          "quitting": "Somewhat helpful"
        }
      },
      {
        "input_message": "If you get any urges tonight, why not confront them head on? Ask the urge - what's it going to give you? It's not going to make you richer, or better looking, and it's not going to leave you if you give in either!",
        "ImageID": "D32",
        "ratings": {
          "content": "Acceptable",
          "design": "Good",
          "coping": "Moderately helpful",
          "quitting": "Moderately helpful"
        }
      },
      {
        "input_message": "When a craving hits, keep your hands busy by doing the dishes or taking out the trash. Small chores will help pass the time during a craving.",
        "ImageID": "D41",
        "ratings": {
          "content": "Poor",
          "design": "Poor",
          "coping": "Not at all helpful",
          "quitting": "Not at all helpful"
        }
      },
      {
        "input_message": "Keep your mind occupied if you get an urge. Do a mental puzzle, make your next shopping list, read a book, write a poem\u2026you might be surprised how well occupying your mind can get rid of urges.",
        "ImageID": "D35",
        "ratings": {
          "content": "Poor",
          "design": "Poor",
          "coping": "Not at all helpful",
          "quitting": "Not at all helpful"
        }
      },
      {
        "input_message": "Ask yourself, \"What do I need right now? Is it really a smoke, or is there something else I need? How can I best take care of myself right now?\"",
        "ImageID": "D62",
        "ratings": {
          "content": "Good",
          "design": "Acceptable",
          "coping": "Moderately helpful",
          "quitting": "Somewhat helpful"
        }
      },
      {
        "input_message": "Try to stop smoking by setting yourself a rule. For example, \"IF I am tempted, THEN I will chew on some mints\" - make your own rule that will work for you.",
        "ImageID": "D9",
        "ratings": {
          "content": "Acceptable",
          "design": "Acceptable",
          "coping": "Somewhat helpful",
          "quitting": "Somewhat helpful"
        }
      }
    ]
  },
  "summary_text": "Age 30, Female, Every day, Motivation: Extremely motivated, Support: Moderately supportive, CPD: 4, TTF: After 30 minutes"
}