{
  "participant_id": "R_1rNXF2yItjOwGZ3",
  "demographics": {
    "age_years": 28,
    "gender_identity": "Female",
    "race_ethnicity": "White",
    "is_hispanic_latino": "No",
    "education_level": "High school graduate or GED",
    "household_income": "$25,000-39,999"
  },
  "smoking_behavior": {
    "quit_intention": "Will quit in the next month",
    "days_smoked_past_30d": 28,
    "cigs_per_day": "10",
    "time_to_first_cig": "After 30 minutes",
    "household_smokers": "Yes",
    "friends_smoke_level": "Some of them",
    "quit_attempts_count": "1",
    "smoking_status": "Every day",
    "quit_motivation_level": "Very motivated",
    "social_support_to_quit": "Extremely supportive"
  },
  "psychosocial": {
    "pain_blocks_valued_life": "Never true",
    "fear_of_feelings": "Seldom true",
    "worry_about_control": "Seldom true",
    "memories_block_fulfillment": "Never true",
    "emotions_cause_problems": "Frequently true",
    "others_handle_life_better": "Always true",
    "worry_blocks_success": "Almost always true"
  },
  "history": {
    "rated_messages": [
      {
        "input_message": "Write down why you want to stop smoking to resist a craving. Remember, trying something to beat the urge is always better than doing nothing. Each time you resist a cig, you're one step closer to being tobacco-free.",
        "ImageID": "D46",
        "ratings": {
          "content": "Good",
          "design": "Acceptable",
          "coping": "Very helpful",
          "quitting": "Moderately helpful"
        }
      },
      {
        "input_message": "Try to stop smoking by setting yourself a rule. For example, \"IF I am tempted, THEN I will chew on some mints\" - make your own rule that will work for you.",
        "ImageID": "D9",
        "ratings": {
          "content": "Good",
          "design": "Acceptable",
          "coping": "Very helpful",
          "quitting": "Extremely helpful"
        }
      },
      {
        "input_message": "Think about your hero, or someone you admire. What do you admire about them? Often our heroes are people who struggle and succeed in difficult circumstances. Now's the chance to be your own hero - by not smoking despite the challenges of stress and strong urges!",
        "ImageID": "D20",
        "ratings": {
          "content": "Very good",
          "design": "Very good",
          "coping": "Somewhat helpful",
          "quitting": "Moderately helpful"
        }
      },
      {
        "input_message": "No need to get rid of these feelings or control them with a smoke. They are not permanent.",
        "ImageID": "A45",
        "ratings": {
          "content": "Very good",
          "design": "Very good",
          "coping": "Extremely helpful",
          "quitting": "Very helpful"
        }
      },
      {
        "input_message": "Read this rule out loud (if you can): IF someone offers me a cigarette THEN I will say 'no thanks, I don't want one.' Reading out if/then rules has been shown to help people stick with their decisions.",
        "ImageID": "D25",
        "ratings": {
          "content": "Good",
          "design": "Very good",
          "coping": "Moderately helpful",
          "quitting": "Somewhat helpful"
        }
      },
      {
        "input_message": "As smokers are usually with you in this location, it's really important that you're not with them when they smoke. Consider avoiding this place if possible until things settle down.",
        "ImageID": "D37",
        "ratings": {
          "content": "Very good",
          "design": "Good",
          "coping": "Extremely helpful",
          "quitting": "Extremely helpful"
        }
      },
      {
        "input_message": "Notice what is triggering your urge. Have understanding and kindness for yourself for feeling this urge. It isn't easy, but can you choose to let it be there without smoking?",
        "ImageID": "A19",
        "ratings": {
          "content": "Good",
          "design": "Very good",
          "coping": "Very helpful",
          "quitting": "Moderately helpful"
        }
      },
      {
        "input_message": "If you find sounds soothing, tune in to the soundtrack of nature, like crashing waves, the wind rustling through trees, or birds singing.",
        "ImageID": "D48",
        "ratings": {
          "content": "Good",
          "design": "Very good",
          "coping": "Extremely helpful",
          "quitting": "Extremely helpful"
        }
      },
      {
        "input_message": "Use self-talk to stay motivated and determined. Say, \u201cI don't need a cigarette. I might WANT one, but I don\u2019t NEED it.\u201d",
        "ImageID": "D53",
        "ratings": {
          "content": "Very good",
          "design": "Very good",
          "coping": "Extremely helpful",
          "quitting": "Very helpful"
        }
      },
      {
        "input_message": "Reduce your stress by using your next break to list four things that have gone well so far today. It might feel like a bit of effort, but doing this will help your mind to refocus, and help you to feel calmer.",
        "ImageID": "D1",
        "ratings": {
          "content": "Very good",
          "design": "Very good",
          "coping": "Extremely helpful",
          "quitting": "Extremely helpful"
        }
      }
    ]
  },
  "summary_text": "Age 28, Female, Every day, Motivation: Very motivated, Support: Extremely supportive, CPD: 10, TTF: After 30 minutes"
}