{
  "participant_id": "R_OdINEEhkfMxwJB7",
  "demographics": {
    "age_years": 27,
    "gender_identity": "Male",
    "race_ethnicity": "White",
    "is_hispanic_latino": "Yes",
    "education_level": "Bachelor's degree",
    "household_income": "$60,000-79,999"
  },
  "smoking_behavior": {
    "quit_intention": "Will quit in the next month",
    "days_smoked_past_30d": 24,
    "cigs_per_day": "2",
    "time_to_first_cig": "Within 30 minutes",
    "household_smokers": "Yes",
    "friends_smoke_level": "Most of them",
    "quit_attempts_count": "2",
    "smoking_status": "Every day",
    "quit_motivation_level": "Extremely motivated",
    "social_support_to_quit": "Extremely supportive"
  },
  "psychosocial": {
    "pain_blocks_valued_life": "Frequently true",
    "fear_of_feelings": "Almost always true",
    "worry_about_control": "Frequently true",
    "memories_block_fulfillment": "Almost always true",
    "emotions_cause_problems": "Always true",
    "others_handle_life_better": "Always true",
    "worry_blocks_success": "Almost always true"
  },
  "history": {
    "rated_messages": [
      {
        "input_message": "Instead of smoking, take 10 deep, slow breaths and count them. Pay attention to what your breathing feels like. If you lose count, that's okay, just start over at 1 until you get to 10.",
        "ImageID": "D59",
        "ratings": {
          "content": "Very good",
          "design": "Very good",
          "coping": "Extremely helpful",
          "quitting": "Very helpful"
        }
      },
      {
        "input_message": "Take a deep breath. Focus on today and the things you have accomplished. How many urges have you let pass? Give yourself some credit!",
        "ImageID": "A17",
        "ratings": {
          "content": "Good",
          "design": "Very good",
          "coping": "Extremely helpful",
          "quitting": "Extremely helpful"
        }
      },
      {
        "input_message": "Step back from what is stressful by taking 10 slow breaths. Count them as you go and notice your breath. If you get distracted, keep starting over until you get to 10.",
        "ImageID": "D67",
        "ratings": {
          "content": "Very good",
          "design": "Good",
          "coping": "Very helpful",
          "quitting": "Extremely helpful"
        }
      },
      {
        "input_message": "Write down why you want to stop smoking to resist a craving. Remember, trying something to beat the urge is always better than doing nothing. Each time you resist a cig, you're one step closer to being tobacco-free.",
        "ImageID": "D46",
        "ratings": {
          "content": "Very good",
          "design": "Very good",
          "coping": "Very helpful",
          "quitting": "Very helpful"
        }
      },
      {
        "input_message": "When you begin to crave a cig, concentrate on your reasons for not smoking. Keep a list on your phone and look at it when you feel yourself beginning to falter.",
        "ImageID": "D50",
        "ratings": {
          "content": "Good",
          "design": "Very good",
          "coping": "Very helpful",
          "quitting": "Very helpful"
        }
      },
      {
        "input_message": "Imagine walking into a social situation in three months' time as a non-smoker. Now hold that picture and imagine you're that person now. Seeing yourself as a non-smoker now can make it much easier to resist!",
        "ImageID": "D27",
        "ratings": {
          "content": "Good",
          "design": "Very good",
          "coping": "Extremely helpful",
          "quitting": "Very helpful"
        }
      },
      {
        "input_message": "If you find yourself with a few minutes to spare, it can be nice to read back over old messages. It's also a chance to reply to ones that you might have forgotten about!",
        "ImageID": "D18",
        "ratings": {
          "content": "Good",
          "design": "Good",
          "coping": "Extremely helpful",
          "quitting": "Extremely helpful"
        }
      },
      {
        "input_message": "Try to avoid seeing other people smoke. It might sound basic but brain see, brain want! If you can, make life easier and avoid the people you used to smoke with for some time where possible.",
        "ImageID": "D30",
        "ratings": {
          "content": "Very good",
          "design": "Good",
          "coping": "Extremely helpful",
          "quitting": "Extremely helpful"
        }
      },
      {
        "input_message": "Did you know that just seeing other people smoke activates a part of your brain that is connected with the action of you smoking? This can bring on strong urges to smoke. One simple solution is to avoid seeing others smoke.",
        "ImageID": "D7",
        "ratings": {
          "content": "Very good",
          "design": "Very good",
          "coping": "Very helpful",
          "quitting": "Extremely helpful"
        }
      },
      {
        "input_message": "It's quite common for people to try and give themselves reasons for having 'just one' when they start working on quitting smoking. If you have these thoughts, let them happen, then picture yourself putting them into a hot-air balloon and watch them float away.",
        "ImageID": "A2",
        "ratings": {
          "content": "Very good",
          "design": "Very good",
          "coping": "Very helpful",
          "quitting": "Extremely helpful"
        }
      }
    ]
  },
  "summary_text": "Age 27, Male, Every day, Motivation: Extremely motivated, Support: Extremely supportive, CPD: 2, TTF: Within 30 minutes"
}