{
  "participant_id": "R_3HzwS0g8RrVjx2x",
  "demographics": {
    "age_years": 29,
    "gender_identity": "Female",
    "race_ethnicity": "Black or African American",
    "is_hispanic_latino": "No",
    "education_level": "Professional or Doctoral degree (MD, JD, PhD, etc.)",
    "household_income": ">=$100,000"
  },
  "smoking_behavior": {
    "quit_intention": "Are currently trying to quit",
    "days_smoked_past_30d": 13,
    "cigs_per_day": "10",
    "time_to_first_cig": "Within 30 minutes",
    "household_smokers": "Yes",
    "friends_smoke_level": "Most of them",
    "quit_attempts_count": "5",
    "smoking_status": "Every day",
    "quit_motivation_level": "Very motivated",
    "social_support_to_quit": "Very supportive"
  },
  "psychosocial": {
    "pain_blocks_valued_life": "Almost always true",
    "fear_of_feelings": "Almost always true",
    "worry_about_control": "Frequently true",
    "memories_block_fulfillment": "Almost always true",
    "emotions_cause_problems": "Almost always true",
    "others_handle_life_better": "Almost always true",
    "worry_blocks_success": "Almost always true"
  },
  "history": {
    "rated_messages": [
      {
        "input_message": "Notice what is triggering your urge. Have understanding and kindness for yourself for feeling this urge. It isn't easy, but can you choose to let it be there without smoking?",
        "ImageID": "A19",
        "ratings": {
          "content": "Good",
          "design": "Good",
          "coping": "Very helpful",
          "quitting": "Extremely helpful"
        }
      },
      {
        "input_message": "Seeing other people smoke is a predictable and unavoidable trigger. Take 5 slow, deep breaths and remind yourself that the urge will pass and that you do not need to smoke.",
        "ImageID": "A56",
        "ratings": {
          "content": "Good",
          "design": "Good",
          "coping": "Very helpful",
          "quitting": "Very helpful"
        }
      },
      {
        "input_message": "This craving is just an event. A game. It will pass. The game gets easier the more you let your urge pass without smoking. But, it gets harder every time you give in to the urge and smoke.",
        "ImageID": "A31",
        "ratings": {
          "content": "Good",
          "design": "Good",
          "coping": "Extremely helpful",
          "quitting": "Very helpful"
        }
      },
      {
        "input_message": "Instead of lighting up a cigarette, light a scented candle or burn some incense.",
        "ImageID": "D47",
        "ratings": {
          "content": "Good",
          "design": "Good",
          "coping": "Very helpful",
          "quitting": "Extremely helpful"
        }
      },
      {
        "input_message": "Practice staying in this location without smoking. Just notice your urge. Practicing this will weaken this trigger with time. Just think of it as practice.",
        "ImageID": "A51",
        "ratings": {
          "content": "Good",
          "design": "Good",
          "coping": "Extremely helpful",
          "quitting": "Extremely helpful"
        }
      },
      {
        "input_message": "Don't let anyone tell you how you should or shouldn't feel today. You feel how you feel and that's it. If you're happy and grateful then enjoy the moment, if you're angry and frustrated, know that this will pass.",
        "ImageID": "A5",
        "ratings": {
          "content": "Good",
          "design": "Good",
          "coping": "Very helpful",
          "quitting": "Very helpful"
        }
      },
      {
        "input_message": "Try to avoid seeing other people smoke. It might sound basic but brain see, brain want! If you can, make life easier and avoid the people you used to smoke with for some time where possible.",
        "ImageID": "D30",
        "ratings": {
          "content": "Good",
          "design": "Good",
          "coping": "Very helpful",
          "quitting": "Very helpful"
        }
      },
      {
        "input_message": "When you are stressed, it is easy to focus on the things that are going wrong. Take a few moments to focus on 5 things that have gone well or that you are thankful for this week.",
        "ImageID": "A38",
        "ratings": {
          "content": "Good",
          "design": "Good",
          "coping": "Very helpful",
          "quitting": "Very helpful"
        }
      },
      {
        "input_message": "When your mind tells you that you will be less stressed after smoking a cigarette, remember that you don't have to listen to that thought. It's just a thought and nothing more.",
        "ImageID": "A32",
        "ratings": {
          "content": "Good",
          "design": "Good",
          "coping": "Extremely helpful",
          "quitting": "Extremely helpful"
        }
      },
      {
        "input_message": "Even though you are stressed, are you willing to sit with this urge until it passes if will help you break this habit?",
        "ImageID": "A35",
        "ratings": {
          "content": "Good",
          "design": "Good",
          "coping": "Very helpful",
          "quitting": "Extremely helpful"
        }
      }
    ]
  },
  "summary_text": "Age 29, Female, Every day, Motivation: Very motivated, Support: Very supportive, CPD: 10, TTF: Within 30 minutes"
}